entorno,nombre,etapa,tipo,area_responsable,descripcion,monto_contrato,comuna,barrio,direccion,fecha_inicio,fecha_fin_inicial,plazo_meses,porcentaje_avance,licitacion_oferta_empresa,licitacion_anio,contratacion_tipo,nro_contratacion,cuit_contratista,mano_obra,destacada,expediente_numero,financiamiento
Plan 54 escuelas,"Escuela de Educación Primaria N.° 24 D.E. 15 ""Francisco Morazán"" - Siglo XXI",Finalizada,Escuelas,Ministerio de Educación,Primaria,"$ 67.065.700,00",12,Villa Urquiza,"RIVERA, PEDRO I., DR. 4221",1/12/2013,31/5/2016,29,100,Criba S.A.,2013,Licitación Pública,2030-MDUGC-2013,30505454436,0,SI,914412-MDUGC-2013,Desconocido
Donado Holmberg,Calle Holmberg: Nivelación en cruce,Finalizada,Espacio Público,Secretarí­a de Transporte y Obras Públicas,"En el marco del proyecto urbano del Barrio Parque Donado Holmberg, se creó un parque lineal planteado como un recorrido que incluyó pequeñas plazas y generó continuidad fí­sica y espacial a lo largo de toda su traza, mediante la nivelación de los cruces en las intersecciones del par Holmberg y Donado con las calles Tomás le Bretón, Pedro Ignacio Iivera, Blanco Encalada, Mendoza, Virrey del Pino y Carbajal.","$ 9.950.017,00",12,Villa Urquiza,HOLMBERG Y OLAZABAL AV.,16/3/2015,15/7/2016,16,100,Altote S.A,2014,Licitación Pública,957/2014,30707431896,16,Desconocido,5515928/2014,Desconocido
Área Ambiental Central,Área Ambiental Central: Calles Alsina Y Moreno,Finalizada,Espacio Público,Secretarí­a de Transporte y Obras Públicas,"Se intervinieron los tramos comprendidos entre la Av. Presidente Julio Argentino Roca y la calle Defensa, realizando obras de nivelación, colocación de dársenas de carga y descarga, nuevas luminarias y se reemplazó el pavimiento por el granitullo para recuperar el aspecto tradicional de la calle.","$ 36.942.632,00",1,Montserrat,"ALSINA, ADOLFO E IRIGOYEN, BERNARDO DE",12/1/2016,15/11/2017,22,100,Rol Ingenieria S.A,2016,Licitación Pública,640-SIGAF/16,30578447659,55,Desconocido,0,Desconocido
Área Ambiental Central,Área Ambiental Central: Calle Esmeralda I,Finalizada,Espacio Público,Secretarí­a de Transporte y Obras Públicas,"La obra incluyó el tramo ubicado entre la Av. Santa Fe y la Av. de Mayo en donde se realizaron obras de nivelación con el objetivo de dejar un carril central para tránsito liviano, restringiendo el paso de colectivos. Además, se intalarón nuevas luminarias y se plantarón árboles.","$ 26.938.294,00",1,San Nicolás,ESMERALDA Y CORRIENTES AV.,27/10/2014,28/2/2017,28,100,Dal Construcciones S.A,2014,Licitación Pública,305/2014,30604370171,59,Desconocido,0,Desconocido
Villa Olí­mpica,Villa Olí­mpica: Viviendas II,Finalizada,Vivienda,Secretarí­a de Transporte y Obras Públicas,La segunda licitación comprendió la construcción de 3 edificios con una superficie aproximada de 13.000m2 destinados a vivienda y 470m2 que fueron destinados a locales comerciales.,"$ 148.823.367,00",8,Villa Lugano,"FERNANDEZ DE LA CRUZ, F., GRAL. AV. Y ESCALADA AV.",15/2/2016,30/8/2017,18,100,EMACO SA - CONSTRUCTORA LANUSSE SA -UTE,2015,Licitación Pública,115/2015,30714969362,0,SI,16.821.753-0GPUYAJ2014,Desconocido
Villa Olí­mpica,Villa Olí­mpica: Viviendas III,Finalizada,Vivienda,Secretarí­a de Transporte y Obras Públicas,El tercer conjunto licitado comprendió la construcción de 3 edificios con una superficie aproximada de 13.000m2 que fueron destinados a vivienda y 370m2 que fueron destinados a locales comerciales.,"$ 179.192.366,00",8,Villa Lugano,"FERNANDEZ DE LA CRUZ, F., GRAL. AV. Y ESCALADA AV.",25/2/2016,15/10/2017,20,100,Bricons S.A.I.C.F.I.,2015,Licitación Pública,329-329-MDUGC-2015,30541068151,0,Desconocido,1026045-1026045-DGPUYA-2015,Desconocido
Villa Olí­mpica,Villa Olí­mpica: Viviendas IV,Finalizada,Vivienda,Secretarí­a de Transporte y Obras Públicas,La cuarta licitación comprendió la construcción de 3 edificios con una superficie de aproximada de 14.050m2 destinados a vivienda y 380m2 que fueron destinados a locales comerciales.,"$ 163.279.322,00",8,Villa Lugano,"FERNANDEZ DE LA CRUZ, F., GRAL. AV. Y ESCALADA AV.",15/2/2016,30/8/2017,18,100,Dycasa S.A.,2015,Licitación Pública,395/2015,33516294189,0,Desconocido,2.163.614-MGEYA-DGPUYA-2015,Desconocido
Villa Olí­mpica,Villa Olí­mpica: Viviendas IX,Finalizada,Vivienda,Secretarí­a de Transporte y Obras Públicas,La licitación Nº 9 contempló la construcción de 3 edificios con una superficie aproximada de 9.900m2 que fueron destinados a vivienda y 250m2 que fueron destinados a locales comerciales.,"$ 137.837.183,00",8,Villa Lugano,"FERNANDEZ DE LA CRUZ, F., GRAL. AV. Y ESCALADA AV.",28/3/2016,15/2/2018,23,100,Criba S.A.,2015,Licitación Pública,580/2015,30505454436,0,Desconocido,12.809.363-MGEYA-DGPUYA-2015,Desconocido
Villa Olí­mpica,Villa Olí­mpica: Viviendas V,Finalizada,Vivienda,Secretarí­a de Transporte y Obras Públicas,La licitación Nº 5 contempló la construcción de 3 edificios con una superficie aproximada de 13.000m2 que fueron destinados a vivienda y 230m2 que fueron destinados a locales comerciales.,"$ 166.503.404,00",8,Villa Lugano,"FERNANDEZ DE LA CRUZ, F., GRAL. AV. Y ESCALADA AV.",15/3/2016,30/9/2017,18,100,Dycasa S.A.,2015,Licitación Pública,396/2015,33516294189,0,Desconocido,2.254.226-MGEYA-DGPUYA-2015,Desconocido
Villa Olí­mpica,Villa Olí­mpica: Viviendas VI,Finalizada,Vivienda,Secretarí­a de Transporte y Obras Públicas,La licitación Nº 6 contempló la construcción de 3 edificios con una superficie aproximada de 11.700m2 que fueron destinados a vivienda y 430m2 que fueron destinados a locales comerciales.,"$ 160.833.300,00",8,Villa Lugano,"FERNANDEZ DE LA CRUZ, F., GRAL. AV. Y ESCALADA AV.",15/2/2016,30/8/2017,18,100,Criba S.A.,2015,Licitación Pública,450/2015,30505454436,0,Desconocido,EX-2015-03683859- -MGEYA-DGPUYA,Desconocido
Villa Olí­mpica,Villa Olí­mpica: Viviendas VII,Finalizada,Vivienda,Secretarí­a de Transporte y Obras Públicas,La licitación Nº 7 contempló la construcción de aproximadamente 9.900m2 que fueron destinados a vivienda y 250m2 que fueron destinados a locales comerciales.,"$ 123.691.183,00",8,Villa Lugano,"FERNANDEZ DE LA CRUZ, F., GRAL. AV. Y ESCALADA AV.",25/2/2016,31/10/2017,20,100,Cunumi S.A,2015,Licitación Pública,449/2015,30615748036,0,Desconocido,7.482.410-MGEYA-DGPUYA-2015,Desconocido
Villa Olí­mpica,Villa Olí­mpica: Viviendas VIII,Finalizada,Vivienda,Secretarí­a de Transporte y Obras Públicas,La licitación Nº 8 contempló la construcción de 4 edificios que fueron destinados a los Juegos Olí­mpicos. Se construyeron aproximadamente 12.900m2 que fueron destinados a y 410m2 que fueron destinados a locales comerciales.,"$ 174.609.630,00",8,Villa Lugano,"FERNANDEZ DE LA CRUZ, F., GRAL. AV. Y ESCALADA AV.",15/2/2016,15/11/2017,21,100,Constructora Sudamericana S.A.,2015,Licitación Pública,528/2015,30610895456,0,Desconocido,7.483.365-MGEYA-DGPUYA-2015,Desconocido
Villa Olí­mpica,Villa Olí­mpica: Viviendas X,Finalizada,Vivienda,Secretarí­a de Transporte y Obras Públicas,"La licitación Nº 10 completó el grupo de licitaciones de viviendas para los Juegos Olí­mpicos que dieron respuesta habitacional, contemplando 2 edificios destinados a los Juegos Olimpicos. Además, se construyerón aproximadamente 7.000m2 que fueron destinados a vivienda y 130m2 que fueron destinados a locales comerciales.","$ 98.174.265,00",8,Villa Lugano,"FERNANDEZ DE LA CRUZ, F., GRAL. AV. Y ESCALADA AV.",28/4/2016,31/12/2017,20,100,Vidogar Construcciones S.A,2015,Licitación Pública,573/2015,30553433564,0,Desconocido,12.808.238-MGEYA-DGPUYA-2015,Desconocido
Villa Olí­mpica,Villa Olí­mpica: Viviendas I,Finalizada,Vivienda,Secretarí­a de Transporte y Obras Públicas,La licitación Nº 1 contempló la construcción de 3 edificios de uso mixto. Se destinaron aproximadamente 12.400m2 que fueron destinados a vivienda y 160m2 que fueron destinados a locales comerciales.,"$ 154.853.715,00",8,Villa Lugano,"FERNANDEZ DE LA CRUZ, F., GRAL. AV. Y ESCALADA AV.",1/6/2015,20/12/2017,30,100,Cavcon S.A.,2015,Licitación Pública,1876/2014,33707292259,0,Desconocido,15282589-DGPUYA/2D14,Desconocido
Villa Olí­mpica,Villa Olimpica: Provisión Y Colocación De Equipamiento De Cocina En Edificios Villa Olí­mpica,Finalizada,Vivienda,Corporación Buenos Aires Sur,"La Obra Consiste En La Provisión Y Colocación De Equipamiento En Las Cocinas, SUM, Espacios De Parrilla, Lavaderos Y Locales De Los 29 Edificios De Villa Olí­mpica","$ 58.565.032,00",8,Villa Lugano,ESCALADA AV. 4200,7/8/2018,4/5/2019,9,100,CALELLO HERMANOS SA,2018,Licitación Pública,04-CBAS-2018,30500716858,0,Desconocido,0,Desconocido
Parque Olí­mpico,"Parque Olí­mpico: Demolición total, extracción y trasplante de árboles, cerco perimetral",Finalizada,Espacio Público,Secretarí­a de Transporte y Obras Públicas,"Se procedió a la contrucción de un cerco olí­mpico perimetral que ayudó a delimitar el área de intervención, resguardando la ejecución de los trabajos y a su vez funcionando como cerco definitivo una vez terminada las obras. Además, incluyó también las tareas de demolición de los edificios y equipamientos obsoletos existentes, la extracción y trasplante de los árboles y arbustos dentro del mismo predio.","$ 48.590.604,00",8,Villa Soldati,AUTOPISTA PRESIDENTE HECTOR J. CAMPORA Y 27 DE FEBRERO AV.,28/12/2016,30/3/2017,3,100,Salvatori S.A Parques Y Jardines,2016,Licitación Pública,880-SIGAF/16,30512700124,0,SI,20515970-DGIURB-2016,Desconocido
Parque Olí­mpico,"Parque Olí­mpico: Instalación de red de agua potable, incendio cloacal, pluvial y red de gas.",Finalizada,Hidráulica e Infraestructura,Secretarí­a de Transporte y Obras Públicas,"Se realizaron obras de infraestructura de las nuevas redes internas de agua potable, desagí¼es cloacales, desagí¼es pluviales y red de gas para los pabellones y equipamientos deportivos del Parque Olí­mpico.","$ 42.340.809,00",8,Villa Soldati,AUTOPISTA PRESIDENTE HECTOR J. CAMPORA Y 27 DE FEBRERO AV.,30/1/2017,16/4/2018,15,100,Tecma S.A.,2016,Licitación Pública,1032-SIGAF/16,30623866528,0,Desconocido,20.669.375-DGIURB-2016,Desconocido
Parque Olí­mpico,Parque Olí­mpico: Pabellones A1 Y A2.,Finalizada,Arquitectura,Secretarí­a de Transporte y Obras Públicas,Se realizaron obras de los pabellones para albergar los diferentes equipamientos deportivos.,"$ 194.988.604,00",8,Villa Soldati,AUTOPISTA PRESIDENTE HECTOR J. CAMPORA Y 27 DE FEBRERO AV.,15/2/2017,31/12/2017,10,100,Constructora Sudamericana S.A.,2016,Licitación Pública,1192-SIGAF/16,30610895456,0,Desconocido,2016-24004377-MGEYA-DGIURB,Desconocido
Parque Olí­mpico,Parque Olí­mpico: Pabellones A3 Y A4.,Finalizada,Arquitectura,Secretarí­a de Transporte y Obras Públicas,Se realizaron obras de los pabellones que incluyeron la infraestructura deportiva para los Juegos Olí­mpicos.,"$ 168.646.366,00",8,Villa Soldati,AUTOPISTA PRESIDENTE HECTOR J. CAMPORA Y 27 DE FEBRERO AV.,15/2/2017,12/1/2018,11,100,Criba S.A.,2016,Licitación Pública,1191-SIGAF/16,30505454436,0,Desconocido,EX-2016-24004750-MGEYA-DGIURB,Desconocido
Parque Olí­mpico,"Parque Olí­mpico: Espacio público, equipamiento deportivo exterior",Finalizada,Espacio Público,Secretarí­a de Transporte y Obras Públicas,"Se contempló la reacondición y modernización del espacio público y equipamiento deportivo exterior. Las áreas deportivas que se encuentran al aire libre incluyeron: 2 pistas de atletismo, canchas de hockey, beach handball, beach voley y basquet. Además, se puso en valor el pórtico de acceso al parque olí­mpico, la construcción de una cabina de control con su sector de servicios y la rehabilitación de la torre tanque acondicionada e incluida al sistema de protección contra incendios.","$ 349.706.395,00",8,Villa Soldati,AUTOPISTA PRESIDENTE HECTOR J. CAMPORA Y 27 DE FEBRERO AV.,7/6/2017,30/10/2018,16,100,Conorvial S.A,2017,Licitación Pública,266/2017,33504596309,0,Desconocido,27359314-DGIURB-2016,Desconocido
Parque Olí­mpico,Parque Olí­mpico: Pabellón C.,Finalizada,Arquitectura,Secretarí­a de Transporte y Obras Públicas,"Se realizaron obras en el Pabellón C que consistieron en la ejecución del complejo natatorio, incluyendo una piscina de saltos con plataformas, una piscina de nado de ocho carriles y las instalaciones complementarias para la realización de las competencias, sala de cronometraje, sanitarios, salas de musculación y preparación de deportistas, salas de máquinas y gradas para espectadores.","$ 508.091.151,00",8,Villa Soldati,AUTOPISTA PRESIDENTE HECTOR J. CAMPORA Y 27 DE FEBRERO AV.,25/4/2017,30/6/2018,14,100,Niro Construcciones S.A.,2017,Licitación Pública,36/ 2017,33588171979,0,Desconocido,EX-2016- 25.688.941í¢ÂÂMGEYA-DGIURB,Desconocido
Villa Olí­mpica,Villa Olimpica: Ejecución Baños En Locales Comerciales En Edificios Villa Olí­mpica,Finalizada,Arquitectura,Corporación Buenos Aires Sur,La Obra Consiste En La Ejecución De Seis Núcleos Sanitarios En Sector De Locales Comerciales En Cinco De Los Edificios De Villa Olí­mpica ,"$ 1.686.743,00",8,Villa Lugano,ESCALADA AV. 4200,19/11/2018,19/1/2019,2,100,Bosquimano S.A,2018,Contratación Directa,54-CBAS-2018,30711470022,0,Desconocido,0,Desconocido
Villa Olí­mpica,Villa Olimpica: Readecuación  Locales Planta Baja Edificios UG7 Villa Olí­mpica,Finalizada,Arquitectura,Corporación Buenos Aires Sur,La Obra Consiste En La Readecuación De Locales De Planta Baja En Edifio UG7 De Villa Olí­mpica ,"$ 3.118.410,00",8,Villa Lugano,ESCALADA AV. 4200,5/2/2019,6/4/2019,1,100,CM CONSTRUCCIONES SA,2019,Contratación Directa,57-CBAS-2018,30714322660,0,Desconocido,0,Desconocido
Villa Olí­mpica,Villa Olimpica: Provisión Y Colocación De Equipamiento De Cocina En Edificios UG7 P3 Y P4 Villa Olí­mpica,Finalizada,Vivienda,Corporación Buenos Aires Sur,La Obra Consiste En La Provisión y Colocación de Equipamiento de Cocina En Los Edificios UG7 P3 y P4 - Villa Olí­mpica,6595600,8,Villa Lugano,ESCALADA AV. 4200,2/1/2019,11/2/2019,"1,33",100,MIAVASA SA,2019,Licitación Privada,01-CBAS-2018,30677303863,0,Desconocido,0,Desconocido
Parque Olí­mpico,Parque Olí­mpico: Pabellón B.,Finalizada,Arquitectura,Secretarí­a de Transporte y Obras Públicas,"La obra consistió en la construcción del Pabellón C que albergó a la competencia de gimnasia artí­stica y cuentu su vez con los servicios necesarios para su funcionamiento, como vestuarios, baños generales, oficinas y los espacios necesarios de logí­stica, enfermerí­a y doping.","$ 283.389.377,00",8,Villa Soldati,AUTOPISTA PRESIDENTE HECTOR J. CAMPORA Y 27 DE FEBRERO AV.,5/8/2017,30/6/2018,10,100,Criba S.A.,2017,Licitación Pública,35 /17,30505454436,0,Desconocido,24.005.383-DGIURB-2016,Desconocido
Parque Olí­mpico,Parque Olí­mpico: Infraestructura eléctrica.,Finalizada,Hidráulica e Infraestructura,Secretarí­a de Transporte y Obras Públicas,"La licitación contempló el reacondicionamiento y modernización de las instalaciones existentes en el Parque Olí­mpico y la ejecución de la nueva red para la distribución de energí­a de los pabellones y edificios administrativos. La obra incluyó una sub estación de entrada de energí­a, grupo electrógeno de emergencia, transformadores elevadores de tensión e instalaciones de alimentación en los edificios.","$ 54.936.733,00",8,Villa Soldati,AUTOPISTA PRESIDENTE HECTOR J. CAMPORA Y 27 DE FEBRERO AV.,13/2/2017,30/5/2018,15,100,Urban Baires S.A.,2016,Licitación Pública,1035-SIGAF/16,30711290075,0,Desconocido,EX-2016- 20669799-DGIURB,Desconocido
Villa Olí­mpica,"Villa Olimpica: Movimiento De Suelo Y Tareas De Mantenimiento De Espacios Verdes, Manzanas 123A - 123B - 123E - 123I- 123M",Finalizada,Espacio Público,Corporación Buenos Aires Sur,La Obra Consiste En La Nivelación De Los Terrenos Que Se Encuentran Conformados Por El Espacio Urbano De La Villa Olí­mpica,"$ 13.671.988,00",8,Villa Lugano,ESCALADA AV. 4200,6/8/2018,4/11/2018,3,100,MIAVASA SA,2018,Contratación Directa,45-CBAS-2018,30677303863,0,Desconocido,0,Desconocido
Villa Olí­mpica,Villa Olimpica: Pintura Interior Departamentos Edificio UG1:P1-P4-P6-P9; UG2:P1-P3-P5-P7; UG3:P1-P2-P3-P5-P8; UG4:P1-P2-P3-P6-P7-P8; UG5:P1-P2-P3-P4-P5-P6-P7-P8-P9-P10; UG7: P3-P4,Finalizada,Arquitectura,Corporación Buenos Aires Sur,"La obra consiste en la pintura de paredes, puertas interiores y puertas de chapa de todas las unidades funcionales de Los Edificio UG1-UG2-UG3-UG4 UG5 Y UG7 de la Villa Olí­mpica.","$ 150.333.723,00",8,Villa Lugano,ESCALADA AV. 4200,30/11/2018,29/5/2019,6,100,CM CONSTRUCCIONES SA,2018,Contratación Directa,41-CBAS-2018,30714322660,0,Desconocido,0,Desconocido
Paseo Del Bajo,Paseo Del Bajo: Tramo A - Viaductos,Finalizada,Transporte,Secretarí­a de Transporte y Obras Públicas,"La realización de esta obra significó una organización vial que mejoró sustancialmente la circulación de mas de 25.000 vehí­culos, entre ellos casi 10.000 camiones, acortando tiempos de viaje, reduciendo la contaminación visual sonora y del aire y aumentando la seguridad vehicular y de peatones. Esta obra tiene más de 6 kilómetros de extensión que conecta el sur con el norte de la Ciudad. Se encuentra ubicada entre las calles Alicia Moreau de Justo y Madero-Huergo, y luego en la zona de Retiro circulando por Av. Ramos Mejí­a, Antártida Argentina y Castillo. Al costado de la trinchera para vehí­culos pesados<sobre las avenidas Alicia Moreau de Justo y Madero-Huergo, se ubican los carriles para tránsito liviano. Hay cuatro carriles con sentido norte y cuatro al sur (dos con velocidad máxima de 60 y dos de 40 kilómetros por hora), separados por un boulevard de uso exclusivo para autos y colectivos de corta distancia. El í¢ÂÂPaseo del Bajo"" contempló además la creación de nuevos espacios verdes que aportaron en metros cuadrados lo equivalente a casi dos í¢ÂÂíÂ´Parque Lezamaí¢ÂÂ y que están ubicados a los costados de los carriles para vehí­culos livianos y sobre la trinchera para camiones por un total de mas de 60.000 metros cuadrados. Además, se crearon nuevas cicloví­as para facilitar el acceso y fomentar la recreación y la movilidad sustentable en la zona.","$ 1.547.000.000,00",1,Puerto Madero,"HUERGO, ING. AV. Y GARAY, JUAN DE AV.",2/1/2017,30/8/2019,31,100,CORSAN CORVIAM CONSTRUCCION SA,2016,Licitación Pública,2016-01-0007-00,30710216386,0,SI,0,Desconocido
Paseo Del Bajo,Paseo Del Bajo: Tramo B - Trinchera Semicubierta Sur,Finalizada,Transporte,Secretarí­a de Transporte y Obras Públicas,"El tramo B del proyecto contempló el recorrido desde el viaducto sur que conecta con las autopistas 25 de Mayo y Buenos Aires-La Plata hasta el comienzo del tramo C en cercaní­as al parque central. Se desarrolló en trinchera semi cubierta, con tramos peatonales y calles vehiculares pasantes.","$ 1.640.500.000,00",1,Puerto Madero,"HUERGO, ING. AV. Y GARAY, JUAN DE AV.",2/1/2017,30/4/2019,27,100,Green Seosa Pbt Ute,2016,Licitación Pública,2016-01-0008-00,30715467999,0,Desconocido,0,Desconocido
Paseo Del Bajo,Paseo Del Bajo: Tramo C - Trinchera Semicubierta Norte,Finalizada,Transporte,Secretarí­a de Transporte y Obras Públicas,"El tramo C se desarrolló desde el final del tramo B en cercaní­as del parque central hasta el comienzo del viaducto norte en el área de retiro. El primer tramo, al igual que el tramo B, se llevó a cabo en trinchera semi cubierta con tramos peatonales y calles vehiculares pasantes. La segunda parte, a la altura de la Plaza Cañada en Retiro, se llevó a cabo a nivel.","$ 3.183.200.000,00",1,Puerto Madero,"HUERGO, ING. AV. Y GARAY, JUAN DE AV.",1/2/2017,25/4/2019,26,100,Iecsa - Fontana Nicastro Ute,2016,Licitación Pública,2016-01-0009-00,30715471457,0,Desconocido,0,Desconocido
Cuenca Radio Antiguo y Ugarteche,Ramal Austria I,Finalizada,Hidráulica e Infraestructura,Secretarí­a de Transporte y Obras Públicas,"La obra consistió en un conducto de cuatro metros de diámetro realizado mediante la metodologí­a de túnel de excavación manual con revestimiento metálico tipo linner, que en su primera etapa de ejecución se complementó con ocho cámaras de ataque de 4 metros de diámetro ejecutadas con la misma tecnologí­a.","$ 75.368.613,00",2,Recoleta,"DEL LIBERTADOR AV. Y FIGUEROA ALCORTA, PRES. AV.",26/5/2015,30/1/2018,32,100,Tecma S.A.,2015,Desconocida,Desconocido,30623866528,50,Desconocido,0,Desconocido
Cuenca Arroyo Cildañez,Ramal Caaguazú -Ampliación Red Pluvial VII,Finalizada,Hidráulica e Infraestructura,Secretarí­a de Transporte y Obras Públicas,"Los trabajos de la obra hidráulica del ramal Caaguazú consistieron en la ampliación de la capacidad de los ramales para aliviar la red existente y evitar los anegamientos sobre Av. Rivadavia y calle Yerbal. Constó de dos conductos: El primero se inició en la esquina de la calle Yerbal y recorre las calles Yerbal y Urdaneta hasta Av. Rivadavia. La segunda comenzó en la esquina de Caaguazú desde Oliden, pasando por calle Ramon L. Falcón.","$ 69.200.043,00",9,Liniers,"OLIDEN Y FALCON, RAMON L.,CNEL.",28/7/2016,30/4/2018,21,100,SES S.A. - CONSTRUERE INGENIERIA S.A. - RED VII - UNION TRANSITORIA DE EMPRESAS,2016,Desconocida,Desconocido,30715243489,0,Desconocido,0,Desconocido
Cuenca Larrazábal y Escalada,Ramal Escalada -Ampliación Red Pluvial VI,Finalizada,Hidráulica e Infraestructura,Secretarí­a de Transporte y Obras Públicas,"Se realizó una obra de mejoramiento y readecuación de la Red Pluvial VI, para el mejor escurrimiento de las precipitaciones en la comuna 8.","$ 52.685.356,00",8,Villa Riachuelo,"FERNANDEZ DE LA CRUZ, F., GRAL. AV. Y SUAREZ, JOSE LEON",22/8/2016,10/12/2017,16,100,Altote S.A. - Naku Construcciones S.R.L. - (Ute),2015,Desconocida,Desconocido,30712263454,0,Desconocido,0,Desconocido
Cuenca Arroyo Vega,Red Pluvial IV: Ampliación,Finalizada,Hidráulica e Infraestructura,Secretarí­a de Transporte y Obras Públicas,"La obra consistió en la ejecución de conductos circulares con respectivas cámaras, sumideros, nexos y demás componentes secundarios, a fin de resolver en distintas ubicaciones los problemas de anegamientos producidos por la falta de red de captación pluvial, complementarios al plan director de ordenamiento hidráulico.","$ 24.536.126,00",12,Coghlan,"QUESADA Y PEREZ, ROQUE",16/6/2014,31/10/2016,28,100,Altote S.A. - Naku Construcciones S.R.L. - (Ute),2013,Licitación Pública,2529/2013,30712263454,17,Desconocido,2769136/2013,Desconocido
Centro De Exposiciones Y Convenciones,Centro de Exposiciones y Convenciones,Finalizada,Arquitectura,Secretarí­a de Transporte y Obras Públicas,"El equipamiento metropolitano del Centro de Exposiciones y Convenciones se proyectó a partir de la idea de soterrar el edificio para liberar superficie e integrar la cubierta verde al Parque Thays y la Plaza de las Naciones Unidas, formando un gran parque público. Se ubica en el predio de Av. Figueroa Alcorta al lado de la Facultad de Derecho constituyendo un enclave estratégico de la ciudad de Buenos Aires dada su localización y su potencialidad simbólica y espacial. El edificio tiene capacidad para 5.000 asistentes y está conformado por una sala plenaria y otras salas auxiliares divisibles. También cuenta con oficinas, espacios para reuniones, un restaurante, un estacionamiento para 900 vehí­culos y un foyer de 1.600 míÂ². A su vez, tiene acceso a la estación Facultad de Derecho de la lí­nea H.","$ 313.660.000,00",2,Recoleta,"COUTURE, EDUARDO J. Y VAZ FERREIRA, CARLOS, DR.",20/12/2014,30/4/2017,28,100,C.R.I.B.A. SA - MEJORES HOSPITALES SA - UNION TRANSITORIA DE EMPRESAS,2013,Licitación Pública,2.594/2013,30714365440,170,SI,4.150.195/2013,Desconocido
Edificio Lezama,Edificio Lezama: Obra Civil,Finalizada,Arquitectura,Secretarí­a de Transporte y Obras Públicas,"La obra del Palacio Lezama se integró dentro del plan de descentralización administrativa del gobierno porteño al sur de la Ciudad. El edificio es patrimonio histórico de la Ciudad y un hito de la memoria urbana del Barrio de Barracas que se encuentra ubicado sobre la Av. Martí­n Garcí­a, entre la calle Irala y Av. Regimiento de los Patricios. Posee una superficie aproximada de 30.000 M2 distribuidos en planta baja y 6 pisos, con acceso de vehí­culos por calle Pilcomayo. Fue remodelado y restaurado í­ntegramente, restaurando la fachada original para satisfacer los requerimientos tecnológicos, funcionales y de seguridad de las dependencias que trabajaban allí­. El edificio tiene capacidad para 3.100 puestos de trabajo correspondientes al Ministerio de Modernización, Ministerio de Desarrollo Urbano y Transporte, Ministerio de Ambiente y Espacio Público y Sindicatura General.","$ 52.831.053,00",4,La Boca,"GARCIA, MARTIN AV. 346",13/3/2015,30/12/2016,21,100,SES SA,2014,Licitación Pública,1816/SIGAF/2014,30647727545,60,Desconocido,0,Desconocido
Cuenca Arroyo Vega,Arroyo Vega - Mejora de la Eficiencia Hidraulica,Finalizada,Hidráulica e Infraestructura,Secretarí­a de Transporte y Obras Públicas,"Se llevó adelante la obra que implicó entabicar las columnas y las vigas para la mejora de la eficiencia hidráulica del conducto, asegurando el desplazamiento del fluido de la manera más eficaz posible. La obra se ejecutó entre las calles 11 de Septiembre y Balbí­n, bajo la calle Blanco Encalada.","$ 20.356.959,00",13,Belgrano,AV. RAFAEL OBLIGADO 6125,22/12/2014,30/9/2016,21,100,Tecma S.A.,2014,Licitación Pública,1459/2014,30623866528,17,Desconocido,5.428.222/2014,Desconocido
