entorno,nombre,etapa,tipo,area_responsable,descripcion,monto_contrato,comuna,barrio,direccion,fecha_inicio,fecha_fin_inicial,plazo_meses,porcentaje_avance,licitacion_oferta_empresa,licitacion_anio,contratacion_tipo,nro_contratacion,cuit_contratista,mano_obra,destacada,expediente_numero,financiamiento
Autódromo Oscar Y Alfredo Gálvez,Autódromo Oscar Y Alfredo Gálvez: Puesta En Valor Autódromo De Bs. As. Oscar Y Juan Gálvez - Cama De Hormigón Triturado â Circuito Nº 12 â Obra Civil,Finalizada,Espacio Público,Corporación Buenos Aires Sur,"La Obra Consiste En La Remoción Y Limpieza De Suelo Vegetal, En La Zona De La Curva Principal, Excavación Y Armado Del Cajón Para Colocación Del Material, Dicho Desmonte Es De Aproximadamente 0,20 M. En Toda La Superficie De La Curva, Para Luego Realiza Colocación Del Hormigón Triturado Y Distribución En Forma Superficial Y Pareja De 0,25 M De Espesor Aproximadamente.","$ 7.346.340,00",8,Villa Riachuelo,"PAZ, GRAL. AV. Y ROCA, CNEL. AV.",15/6/2017,15/7/2017,1,100,Arco S.R.L,2017,Contratación Directa,23-CBAS-2017,30657249765,0,Desconocido,0,Desconocido
Autódromo Oscar Y Alfredo Gálvez,Autódromo Oscar Y Alfredo Gálvez: Puesta En Valor Autódromo De Bs. As. Oscar Y Juan Gálvez - Intervención Acceso,Finalizada,Espacio Público,Corporación Buenos Aires Sur,"La Obra Consiste En La Puesta En Valor Del Autódromo De La Ciudad De Bs. As. Reparación, Pintura Y Reacondicionamiento General Del Acceso.","$ 1.649.652,00",8,Villa Riachuelo,"PAZ, GRAL. AV. Y ROCA, CNEL. AV.",7/11/2017,8/10/2017,1,100,Isofil S.A.I.Y C.,2017,Contratación Directa,24-CBAS-2017,30552340090,0,Desconocido,0,Desconocido
Autódromo Oscar Y Alfredo Gálvez,Autódromo Oscar Y Alfredo Gálvez: Puesta En Valor Autódromo De Bs. As. Oscar Y Juan Gálvez - Intervención Tanque De Agua,Finalizada,Espacio Público,Corporación Buenos Aires Sur,La Obra Consiste En La Puesta En Valor Del Autódromo De La Ciudad De Bs. As Las Tareas A Ejecutar Corresponden A La Puesta En Valor Del Tanque De Agua.,"$ 994.435,00",8,Villa Riachuelo,"PAZ, GRAL. AV. Y ROCA, CNEL. AV.",16/6/2017,7/11/2017,1,100,Arco S.R.L,2017,Contratación Directa,25-CBAS-2017,30657249765,0,Desconocido,0,Desconocido
Autódromo Oscar Y Alfredo Gálvez,Autódromo Oscar Y Alfredo Gálvez: Puesta En Valor Autódromo De Bs. As. Oscar Y Juan Gálvez - Intervención Plaza De Honor,Finalizada,Espacio Público,Corporación Buenos Aires Sur,"La Obra Consiste En La Puesta En Valor Del Autódromo De La Ciudad De Bs As.Las Tareas A Ejecutar Corresponden A La Puesta En Valor De La Plaza De Honor, Antigua Fuente Y Monumento Central.","$ 3.578.479,00",8,Villa Riachuelo,"PAZ, GRAL. AV. Y ROCA, CNEL. AV.",7/7/2017,8/11/2017,1,100,Mel Contrucciones S.R.L,2017,Contratación Directa,26-CBAS-2017,33714510679,0,Desconocido,0,Desconocido
Autódromo Oscar Y Alfredo Gálvez,Autódromo Oscar Y Alfredo Gálvez: Puesta En Valor Autódromo De Bs. As. Oscar Y Juan Gálvez - Intervención Muro Perimetral,Finalizada,Espacio Público,Corporación Buenos Aires Sur,La Obra Consiste En La Puesta En Valor Del Autódromo De La Ciudad De Bs As. Las Tareas A Ejecutar Corresponden A La Pintura Y Reparación Del Muro Perimetral Del Autódromo.,"$ 3.659.055,00",8,Villa Riachuelo,"PAZ, GRAL. AV. Y ROCA, CNEL. AV.",7/7/2017,8/6/2017,1,100,Garrido Marcelo Pablo,2017,Contratación Directa,27-CBAS-2017,20182721094,0,Desconocido,0,Desconocido
Autódromo Oscar Y Alfredo Gálvez,Autódromo Oscar Y Alfredo Gálvez: Puesta En Valor Autódromo De Bs. As. Oscar Y Juan Gálvez - Intervención Túnel Peatonal,Finalizada,Espacio Público,Corporación Buenos Aires Sur,La Obra Consiste En La Puesta En Valor Del Autódromo De La Ciudad De Bs As.Las Tareas A Ejecutar Corresponden A La Puesta En Valor Del Túnel Peatonal.,"$ 931.469,00",8,Villa Riachuelo,"PAZ, GRAL. AV. Y ROCA, CNEL. AV.",26/6/2017,7/11/2017,"0,5",100,Neltec S.R.L.,2017,Contratación Directa,28-CBAS-2017,30707902341,0,Desconocido,0,Desconocido
Autódromo Oscar Y Alfredo Gálvez,Autódromo Oscar Y Alfredo Gálvez: Puesta En Valor Autódromo De Bs. As. Oscar Y Juan Gálvez - Estructura Sobre Barandas En Plateas,Finalizada,Espacio Público,Corporación Buenos Aires Sur,"La Obra Consiste En La Puesta En Valor Del Autódromo De La Ciudad De Bs As.Las Tareas A Ejecutar Corresponden A La Materialización De Una Estructura Metálica Alrededor De Las Plateas Sobre Las Barandas Existentes, Logrando Alcanzar Una Altura De 2.00 Mts.","$ 227.617,00",8,Villa Riachuelo,"PAZ, GRAL. AV. Y ROCA, CNEL. AV.",7/7/2017,27/7/2017,"0,5",100,Mel Contrucciones S.R.L,2017,Contratación Directa,29-CBAS-2017,33714510679,0,Desconocido,0,Desconocido
Autódromo Oscar Y Alfredo Gálvez,Autódromo Oscar Y Alfredo Gálvez: Puesta En Valor Autódromo De Bs. As. Oscar Y Juan Gálvez - Intervención Tribuna Central,Finalizada,Espacio Público,Corporación Buenos Aires Sur,"La Obra Consiste En La Puesta En Valor Del Autódromo De La Ciudad De Bs As, Las Tareas A Ejecutar Corresponden A La Puesta En Valor De La Tribuna Central","$ 1.782.915,00",8,Villa Riachuelo,"PAZ, GRAL. AV. Y ROCA, CNEL. AV.",7/12/2017,8/11/2017,1,100,Cylp S. A,2017,Contratación Directa,30-CBAS-2017,30567789000,0,Desconocido,0,Desconocido
Autódromo Oscar Y Alfredo Gálvez,Autódromo Oscar Y Alfredo Gálvez: Puesta En Valor Autódromo De Bs. As. Oscar Y Juan Gálvez - Intervención Horquilla,Finalizada,Espacio Público,Corporación Buenos Aires Sur,La Obra Consiste En La Puesta En Valor Del Autódromo De La Ciudad De Bs As.Las Tareas A Ejecutar Corresponden A La Puesta En Valor De La Horquilla,"$ 2.272.672,00",8,Villa Riachuelo,"PAZ, GRAL. AV. Y ROCA, CNEL. AV.",21/7/2017,20/8/2017,1,100,Oznerol S.A.,2017,Contratación Directa,31-CBAS-2017,30714746371,0,Desconocido,0,Desconocido
Autódromo Oscar Y Alfredo Gálvez,Autódromo Oscar Y Alfredo Gálvez: Puesta En Valor Autódromo De Bs. As. Oscar Y Juan Gálvez - Provisión E Instalación De Butacas En Platea A,Finalizada,Espacio Público,Corporación Buenos Aires Sur,La Obra Consiste En La Puesta En Valor Del Autódromo De La Ciudad De Bs Aslas Tareas A Ejecutar Corresponden A La Provisión E Instalación De Butacas En El Sector De Platea A.,"$ 840.030,00",8,Villa Riachuelo,"PAZ, GRAL. AV. Y ROCA, CNEL. AV.",16/6/2017,7/1/2017,"0,5",100,Diseño Y Equipamientos S.R.L.,2017,Contratación Directa,33-CBAS-2017,30708288353,0,Desconocido,0,Desconocido
Entorno La Boca,Centro Comercial A Cielo Abierto Av. Almirante Brown (E/ Av. Pedro De Mendoza Y Av. Martí­n Garcí­a),Finalizada,Espacio Público,Ministerio de Espacio Público e Higiene Urbana,"Esta obra tuvo como principal objetivo la puesta en valor del espacio público en la Avenida Almirante Brown con el objetivo de incentivar el uso, goce y tránsito seguro del espacio urbano. Se repararon veredas, se incorporaron elementos de alumbrado y se realizó el completamiento del arbolado.","$ 34.736.770,00",4,La Boca,"RODRIGUEZ, MARTIN Y VILLAFAÍE, WENCESLAO",5/1/2017,12/1/2017,0,100,Dynco S.A,2016,Desconocida,Desconocido,30708802812,0,Desconocido,0,Desconocido
Autódromo Oscar Y Alfredo Gálvez,Autódromo Oscar Y Alfredo Gálvez: Puesta En Valor Autódromo De Bs. As. Oscar Y Juan Gálvez - Provisión E Instalación De Butacas En Tribuna Central,Finalizada,Espacio Público,Corporación Buenos Aires Sur,La Obra Consiste En La Puesta En Valor Del Autódromo De La Ciudad De Bs Aslas Tareas A Ejecutar Corresponden A La Provisión E Instalación De Butacas En El Sector De La Tribuna Central,"$ 1.436.125,00",8,Villa Riachuelo,"PAZ, GRAL. AV. Y ROCA, CNEL. AV.",16/6/2017,16/7/2017,1,100,Diseño Y Equipamientos S.R.L.,2017,Contratación Directa,35-CBAS-2017,30708288353,0,Desconocido,0,Desconocido
Plazas y Parques de Comuna 4,Parque Patricios: Área de servicios.,Finalizada,Espacio Público,Ministerio de Espacio Público e Higiene Urbana,"Se incorporó un área de servicios en espacios verdes en el playón lindero a la biblioteca infantil Enrique Banchs, la cual se conserva intacta. El programa consta de un sector de confiterí­a (50m2) y un núcleo de sanitarios (40m2) con accesibilidad universal que cumplimientan lo normado por la Ley 4950. También se incorporó equipamiento exterior en el parque, como bicicleteros, bancos y equipos de actividad fí­sica.","$ 5.818.288,00",4,Parque Patricios,DESCONOCIDO,7/1/2017,8/1/2017,0,100,Ingenor S.A,2016,Desconocida,Desconocido,30631453461,0,Desconocido,0,Desconocido
Entorno Monte Castro,Centro Comercial A Cielo Abierto Av. ílvarez Jonte (E/Joaquí­n V. González Y Lope De Vega),Finalizada,Espacio Público,Ministerio de Espacio Público e Higiene Urbana,"Los trabajos que se realizaron están orientados a extender las pautas de diseño existentes en el tramo Lope de Vega -Segurola, al tramo que arranca desde esta última hasta la Av. Joaquí­n V. González. Se realizó el recambio de veredas en todo el sector a intervenir, el soterramiento de cables, se renovó y completó la iluminación a nivel peatonal, y se incorporó arbolado y equipamiento urbano.","$ 54.446.460,00",10,Monte Castro,DESCONOCIDO,8/1/2017,4/1/2018,12,100,Ilubaires S.A,2016,Desconocida,Desconocido,30693811860,0,Desconocido,0,Desconocido
Plan Tribunales,Av. Córdoba (E/ Cerrito Y Callao): Rehabilitación,Finalizada,Espacio Público,Ministerio de Espacio Público e Higiene Urbana,"La intervención propuso la renovación de las aceras, la incorporación de planteras y arbolados, continuando con lo realizado en la primera etapa. A su vez se realizó el soterramiento de cables en toda el área de intervención y se incorporó equipamiento urbano.","$ 21.748.597,00",1,San Nicolás,DESCONOCIDO,11/1/2016,5/1/2017,12,100,Naku Construcciones S.R.L,2016,Desconocida,Desconocido,30575292174,0,Desconocido,0,Desconocido
Entorno Once,Centro Comercial A Cielo Abierto Av. Corrientes ( E/ Callao Y Pueyrredón).,Finalizada,Espacio Público,Ministerio de Espacio Público e Higiene Urbana,"En el marco del Plan Integral Once, se propuso la reparación de veredas, la renovación integral de aceras, cazoletas y vados peatonales, el soterramiento de cableado aéreo, la incorporación de iluminación peatonal y el completamiento del arbolado.","$ 10.000.000,00",3,Balvanera,CORRIENTES AV. Y PASTEUR,9/1/2017,2/1/2018,12,100,Desconocido,2017,Desconocida,Desconocido,Desconocido,0,Desconocido,0,Desconocido
Eje Corrientes,Centro Comercial a Cielo Abierto Av. Corrientes (E/ Acevedo y Julián ílvarez),Finalizada,Espacio Público,Ministerio de Espacio Público e Higiene Urbana,"En el marco del Plan de puesta en valor de centros comerciales a cielo abierto, se propuso la renovación integral de aceras, cazoletas y vados peatonales, el soterramiento de cableado aéreo, la incorporación de iluminación peatonal y el completamiento del arbolado de alineación. Se incluyó además la renovación del monumento a Osvaldo Pugliese.","$ 19.313.668,00",15,Villa Crespo,"CORRIENTES AV. Y DRAGO, LUIS MARIA",5/1/2017,20/11/2017,10,100,Contrata - Altote S.A,2016,Licitación Pública,45/SIGAF/2017,Desconocido,0,Desconocido,27.002.091/DGRU/2016,Desconocido
Eje Corrientes,Eje Corrientes: Centro Comercial A Cielo Abierto Av. Corrientes (E/ Mario Bravo Y Palestina),Finalizada,Espacio Público,Ministerio de Espacio Público e Higiene Urbana,"En el marco del Plan de puesta en valor de centros comerciales a cielo abierto, se propuso la renovación integral de aceras, cazoletas y vados peatonales, el soterramiento de cableado aéreo, la incorporación de iluminación peatonal y el completamiento del arbolado de alineación.","$ 24.174.549,00",5,Almagro,CORRIENTES AV. Y MEDRANO AV.,5/1/2017,15/9/2017,8,100,Naku Construcciones S.R.L,2016,Licitación Pública,Desconocido,30575292174,0,Desconocido,0,Desconocido
Eje Cí­vico,"Avenida de Mayo, Entorno plazas, Virrey Cevallos: Renovación ",Finalizada,Espacio Público,Ministerio de Espacio Público e Higiene Urbana,"En el marco de la puesta en valor del eje cí­vico, se propuso la renovación de aceras en el entorno de la Plaza Congreso, la reparación y mantenimiento de aceras en el entorno de Plaza de Mayo y Av. de Mayo, el ajuste del ritmo de arbolado y alumbrado. Se proyectó también la iluminación de árboles en puntos estratégicos, la rehabilitación de las superficies de plazoletas sobre Sáenz Peña y el ajuste de radios de esquinas en Av. de Mayo.","$ 38.030.890,00",1,Montserrat,DESCONOCIDO,11/1/2016,8/8/2017,19,100,Altote S.A,2016,Desconocida,Desconocido,30707431896,0,Desconocido,0,Desconocido
Entorno Flores,Centro Comercial A Cielo Abierto Av. Gaona (E/ Donato ílvarez Y Argerich),Finalizada,Espacio Público,Ministerio de Espacio Público e Higiene Urbana,"En el marco del Plan de puesta en valor de centros comerciales a cielo abierto, la intervención realizada corresponde a la Avenida Gaona, incluyendo el perí­metro de la plaza comprendida entre las calles Gavilán, Caracas, Luis Viale y Av. Gaona. La intervención propuso la renovación del solado de veredas, incluyendo el soterrado del cableado aéreo, el completamiento del arbolado de alineación retirando aquellos ejemplares que se encontraban en mal estado y plantando nuevos. Se incorporaron luminarias peatonales y se actualizaron a tecnologí­a led aquellos artefactos que eran de mercurio halogenado para reforzar la iluminación de la avenida. Se incorporó equipamiento urbano para incentivar el uso, goce y tránsito seguro del espacio urbano.","$ 37.299.609,00",7,Flores,DESCONOCIDO,5/1/2017,12/1/2017,0,100,Dynco S.A,2016,Desconocida,Desconocido,30708802812,0,Desconocido,0,Desconocido
Entorno Boedo,"Esquinas Salcedo, Mármol, Las Casas y Muñiz: Puesta en valor del entorno ",Finalizada,Espacio Público,Ministerio de Espacio Público e Higiene Urbana,"Se realizó la nivelación de calzada y vereda en las esquinas, la incorporación de nuevas pérgolas y áreas de recreación y descanso, se reforzó la iluminación peatonal, se realizó el completamiento del arbolado urbano, y el ordenamiento vehicular.","$ 20.737.985,00",5,Boedo,DESCONOCIDO,7/1/2017,3/7/2017,6,100,Miavasa S.A,2016,Desconocida,Desconocido,30677303863,0,Desconocido,0,Desconocido
Entorno Villa Devoto,Centro Comercial A Cielo Abierto Av. Lope De Vega (E/ Tinogasta Y Gral. Paz),Finalizada,Espacio Público,Ministerio de Espacio Público e Higiene Urbana,"En el marco del Plan de puesta en valor de centros comerciales a cielo abierto, se propuso la renovación de aceras, el ordenamiento del espacio público, la corrección del ritmo arbolado y alumbrado, la intensificación del alumbrado peatonal y se propusieron nuevos cruces nivelados.","$ 29.209.398,00",11,Villa Devoto,DESCONOCIDO,3/1/2017,1/8/2017,7,100,Miavasa S.A,2016,Desconocida,Desconocido,30677303863,0,Desconocido,0,Desconocido
Entorno Barracas,Centro Comercial a Cielo Abierto Av. Montes De Oca (E/ B Quinquela y Av. Martí­n Garcí­a),Finalizada,Espacio Público,Ministerio de Espacio Público e Higiene Urbana,"En el marco del Plan de puesta en valor de centros comerciales a cielo abierto, se propuso la incorporación de nuevo arbolado, incorporación de farolas ornamentales led en aceras, incorporación de luminarias viales led en el boulevard de montes de oca, renovación total de aceras, soterrado de servicios e incorporación de nuevo equipamiento urbano.","$ 28.054.630,00",4,Barracas,DESCONOCIDO,11/1/2017,1/9/2018,20,100,Instalectro S.A.,2017,Desconocida,Desconocido,33661628729,0,Desconocido,0,Desconocido
Entorno Once,Centro Comercial A Cielo Abierto Av. Pueyrredón Tramo I,Finalizada,Espacio Público,Ministerio de Espacio Público e Higiene Urbana,"Obra enmarcada en el Plan Integral Once, propuso la reparación de veredas, la renovación integral de aceras, cazoletas y vados peatonales, el soterramiento de cableado aéreo, la incorporación de iluminación peatonal, el completamiento del arbolado y mobiliario urbano.","$ 8.200.000,00",3,Balvanera,"MITRE, BARTOLOME Y PUEYRREDON AV.",17/1/2018,17/1/2018,0,100,Miavasa S.A,2017,Desconocida,Desconocido,30677303863,0,Desconocido,0,Desconocido
Entorno Once,Centro Comercial A Cielo Abierto Av. Pueyrredón Tramo II,Finalizada,Espacio Público,Ministerio de Espacio Público e Higiene Urbana,"Obra enmarcada en el Plan Integral Once, propone la reparación de veredas la renovación integral de aceras, cazoletas y vados peatonales, el soterramiento de cableado aéreo, la incorporación de iluminación peatonal, el completamiento del arbolado y mobiliario urbano.","$ 15.300.000,00",3,Balvanera,PUEYRREDON AV. Y SARMIENTO,17/1/2018,17/1/2018,0,100,Miavasa S.A,2017,Desconocida,Desconocido,30677303863,0,Desconocido,0,Desconocido
Entorno Flores,Centro Comercial A Cielo Abierto Av. Rivadavia (E/ Helguera Y Av. Donato ílvarez),Finalizada,Espacio Público,Ministerio de Espacio Público e Higiene Urbana,"En el marco del Plan de puesta en valor de centros comerciales a cielo abierto, se propuso la renovación y reparación de veredas en todo el sector, se refuerzó y corrigió la iluminación peatonal, se incorporó arbolado, se realizó un ordenamiento del espacio público y el soterramiento del cableado aéreo. A su vez, se propuso la nivelación de algunos cruces peatonales, para acentuar la continuidad del recorrido peatonal.","$ 54.975.940,00",7,Flores,DESCONOCIDO,6/1/2017,31/5/2018,16,100,Pelque S.A,2016,Desconocida,Desconocido,30707761535,0,Desconocido,0,Desconocido
Entorno Once,Centro Comercial A Cielo Abierto Av. Rivadavia (E/ Callao Y Pueyrredón),Finalizada,Espacio Público,Ministerio de Espacio Público e Higiene Urbana,"En el marco del Plan Once, se propuso la renovación y reparación de veredas en todo el sector, se reforzó y corrigió la iluminación peatonal, se incorporó arbolado, se hizo un ordenamiento del espacio público y el soterramiento del cableado aéreo. A su vez, se propuso la nivelación de algunos cruces peatonales, para acentuar la continuidad del recorrido peatonal.","$ 25.755.320,00",3,Balvanera,"RIVADAVIA AV. Y COLOMBO, CARLOS AMBROSIO",2/1/2018,11/1/2018,0,100,Algieri S.A,2017,Licitación Pública,1549/SIGAF/2017,30699339810,0,Desconocido,23058047/DGRU/2017,Desconocido
Entorno Boedo,Centro Comercial a Cielo Abierto Av. San Juan (E/ Colombres y Virrey Liniers),Finalizada,Espacio Público,Ministerio de Espacio Público e Higiene Urbana,"En el marco del Plan de puesta en valor de centros comerciales a cielo abierto, se realizó la reparación y reposición de aceras, ordenamiento general, corrección ritmo arbolado y alumbrado, e intensificación del alumbrado peatonal.","$ 5.868.243,00",5,Boedo,DESCONOCIDO,10/1/2016,12/1/2016,0,100,Naku Construcciones S.R.L,2016,Desconocida,Desconocido,30575292174,0,Desconocido,0,Desconocido
Entorno Palermo,Paseo Av. Sarmiento (Ramí­rez),Finalizada,Espacio Público,Ministerio de Espacio Público e Higiene Urbana,"Puesta en valor de la Av. Sarmiento y el Paseo Ramí­rez. Se propuso la renovación de veredas en un amplio sector y se incorporó una dársena vehicular. A su vez, la propuesta mejoró las cualidades ambientales del área mediante la incorporación de arbolado y equipamiento urbano.","$ 24.627.378,00",14,Palermo,DESCONOCIDO,11/1/2016,5/1/2017,12,100,Altote S.A,2016,Desconocida,Desconocido,30707431896,0,Desconocido,0,Desconocido
Entorno Flores,Centro Comercial A Cielo Abierto Av. Varela (E/ Eva Perón Y Bajo Autopista Au. 25 De Mayo),Finalizada,Espacio Público,Ministerio de Espacio Público e Higiene Urbana,"En el marco del Plan de puesta en valor de centros comerciales a cielo abierto, en Av. Varela, en el tramo comprendido entre la calle Primera Junta y la Av. Eva Perón, se propuso el recambio de la totalidad de las veredas, el soterramiento de cables, la renovación de la iluminación a nivel peatonal, la incorporación de arbolado, nuevas rampas de accesibilidad e intervenciones artí­sticas en el sector del bajo autopista.","$ 12.012.804,00",7,Flores,DESCONOCIDO,4/1/2017,15/11/2017,10,100,Avinco Construcciones S.A,2016,Desconocida,Desconocido,33622606939,0,Desconocido,0,Desconocido
Entorno Saavedra,Boulevard San Isidro Labrador: Renovación,Finalizada,Espacio Público,Ministerio de Espacio Público e Higiene Urbana,Se canalizaron flujos vehiculares mediante intervención peatonal. Se realizó la demarcación de sendas peatonales logrando cruces seguros y cortos. Se ejecutaron nuevos vados peatonales. Se realizó la demarcación horizontal en los extremos del Boulevard evitando el estacionamiento indebido. Se incorporó mobiliario urbano en las intervenciones peatonales. Se coloraron elementos reflectivos para incrementar la visibilidad en las intersecciones.,"$ 11.291.008,00",12,Saavedra,DESCONOCIDO,9/1/2016,3/1/2017,12,100,Salvatori S.A Parques Y Jardines,2016,Desconocida,Desconocido,30512700124,0,Desconocido,0,Desconocido
Entorno Flores,Centro Comercial A Cielo Abierto Avellaneda E/ Terrada Y Emilio Lamarca,Finalizada,Espacio Público,Ministerio de Espacio Público e Higiene Urbana,Se canalizaron flujos vehiculares mediante intervención peatonal. Se realizó la demarcación de sendas peatonales logrando cruces seguros y cortos. Se ejecutaron nuevos vados peatonales. Se realizó la demarcación horizontal en los extremos del Boulevard evitando el estacionamiento indebido. Se incorporó mobiliario urbano en las intervenciones peatonales. Se coloraron elementos reflectivos para incrementar la visibilidad en las intersecciones.,"$ 47.806.102,00",7,Flores,DESCONOCIDO,3/1/2017,10/9/2017,8,100,Da Fré Obras Civiles S.A,2016,Desconocida,Desconocido,30711388768,0,Desconocido,0,Desconocido
Entorno Constitución,Centro Trasbordo Constitución,Finalizada,Espacio Público,Ministerio de Espacio Público e Higiene Urbana,"El proyecto para el centro de trasbordo de constitución, que unificó la estación Garay del metrobús sur y la cabecera de la lí­nea c de subte, incluyó la instalación de una cubierta vidriada de 2300 metros cuadrados, la construcción de un nuevo vestí­bulo sobre la plaza con una boleterí­a, la ampliación de un andén lateral, la renovación de los solados guí­a de los andenes, la colocación de torretas de ventilación que aseguran el flujo de aire en la estación y brindan iluminación natural, el reemplazo de la luminaria antigua por iluminación led, la incorporación de carteleras con información y mapas, y la construcción de dos locales comerciales.","$ 112.000.000,00",1,Constitución,DESCONOCIDO,12/1/2014,31/3/2017,38,100,Bricons S.A.I.C.F.I. - Miavasa S.A.- Union Transitoria De Empresas,2014,Desconocida,Desconocido,30714595241,0,Desconocido,0,Desconocido
Entorno Lugano,Conector Ambiental Av. Soldado De La Frontera,Finalizada,Espacio Público,Ministerio de Espacio Público e Higiene Urbana,"Se llevó a cabo la ampliación, renovación y el equipamiento integral de veredas y canteros en dársenas para colectivos, plazas y plazoletas. También el completamiento y ampliación de especies arbóreas, la ampliación de espacios verdes en boulevares, dársenas y plazoletas, la iluminación peatonal, nuevos cruces peatonales elevados y rampas.","$ 51.274.163,00",8,Villa Lugano,DESCONOCIDO,11/1/2016,15/8/2017,19,100,Miavasa S.A,2016,Desconocida,Desconocido,30677303863,0,Desconocido,0,Desconocido
Corredor Verde Del Oeste,Corredor Verde del Oeste: Tramo I - Cruce Medrano,Finalizada,Espacio Público,Ministerio de Espacio Público e Higiene Urbana,"Como primera intervención del proyecto de Techos FFCC Sarmiento esta obra comprendió la rectificación de la calle Bartolomé Mitre y el ensanche de esquina con el objetivo de mejorar la circulación vehicular, aumentar la superficie verde, generar nuevos patios de juegos y postas de descanso. El proyecto también comprendió la renovación e incorporación del mobiliario urbano, refuerzo de la iluminación, e incorporación de arbolado.","$ 60.212.823,00",5,Almagro,DESCONOCIDO,12/1/2016,31/8/2018,31,100,Bricons S.A.I.C.F.I.-Construere Ingenieria S.A. -Union Transitoria,2016,Desconocida,Desconocido,30715430807,0,Desconocido,0,Desconocido
Eje Corrientes,Corrientes Cultural - Etapa I (E/ Pellegrini y Suipacha),Finalizada,Espacio Público,Ministerio de Espacio Público e Higiene Urbana,"Obra que amplió, ordenó y generó nuevos espacios públicos de circulación peatonal, teniendo en cuenta todas las variables que componen el entorno urbano (alumbrado, buses, veredas, equipamiento, etc.) para potenciar la oferta cultural y gastronómica de una de las avenidas emblemáticas de Bs. As.","$ 13.333.334,00",1,San Nicolás,"CORRIENTES AV. Y PELLEGRINI, CARLOS",11/1/2017,15/7/2018,18,100,Desconocido,2017,Desconocida,Desconocido,Desconocido,0,Desconocido,0,Desconocido
Eje Corrientes,Corrientes Cultural - Etapa I (E/ Suipacha y Florida),Finalizada,Espacio Público,Ministerio de Espacio Público e Higiene Urbana,"Obra que amplió, ordenó y generó nuevos espacios públicos de circulación peatonal, teniendo en cuenta todas las variables que componen el entorno urbano (alumbrado, buses, veredas, equipamiento, etc.) para potenciar la oferta cultural y gastronómica de una de las avenidas emblemáticas de Bs. As.","$ 37.500.000,00",1,San Nicolás,CORRIENTES AV. Y ESMERALDA,2/1/2018,15/7/2018,6,100,Desconocido,2017,Desconocida,Desconocido,Desconocido,0,Desconocido,0,Desconocido
Eje Corrientes,Corrientes Cultural - Etapa II (E/ Callao y Cerrito),Finalizada,Espacio Público,Ministerio de Espacio Público e Higiene Urbana,"Obra que amplió, ordenó y generó nuevos espacios públicos de circulación peatonal, teniendo en cuenta todas las variables que componen el entorno urbano (alumbrado, buses, veredas, equipamiento, etc.) para potenciar la oferta cultural y gastronómica de una de las avenidas emblemáticas de la Ciudad de Buenos Aires.","$ 131.448.049,00",1,San Nicolás,CORRIENTES AV. Y PARANA,3/1/2018,27/3/2020,26,100,Algieri S.A,2017,Licitación Pública,1627/SIGAF/2017,30699339810,0,SI,26885156/DGRU/2017,Desconocido
