entorno,nombre,etapa,tipo,area_responsable,descripcion,monto_contrato,comuna,barrio,direccion,fecha_inicio,fecha_fin_inicial,plazo_meses,porcentaje_avance,licitacion_oferta_empresa,licitacion_anio,contratacion_tipo,nro_contratacion,cuit_contratista,mano_obra,destacada,expediente_numero,financiamiento
"Sistema hidrometeorológico integral de Observación, Vigilancia y Alerta","Sistema hidrometeorológico integral de Observación, Vigilancia y Alerta",Finalizada,Hidráulica e Infraestructura,Secretarí­a de Transporte y Obras Públicas,"Sistema hidrometeorológico integral de Observación, Vigilancia y Alerta que permite disponer de información confiable y precisa necesaria para aumentar la capacidad de predicción de mal tiempo en la Ciudad, advirtiendo sobre probables inundaciones y mejorando el manejo de situaciones de emergencia y recuperación.","$ 116.460.262,00",15,Chacarita,GUZMÁN 201,31/10/2016,1/11/2019,37,100,AUTOTROL SA - WDT INC,2014,Desconocida,Desconocido,30504913712,20,Desconocido,0,Desconocido
Pasos Bajo Nivel,Paso Bajo Nivel Balbí­n: Aliviadores,Finalizada,Hidráulica e Infraestructura,Secretarí­a de Transporte y Obras Públicas,"Se prevé una readecuación general del sistema hidráulico y la instalación de una estación de bombeo dotada de grupo electrógeno, que permitirá su funcionamiento ante cortes de energí­a eléctrica.","$ 40.600.521,00",12,Saavedra,"BALBÍ­N, RICARDO, DR. AV. Y PLAZA",12/1/2017,30/4/2018,15,100,ALTOTE - NAKU CONSTRUCCIONES (UTE),0,Desconocida,Desconocido,Desconocido,0,Desconocido,0,Desconocido
Donado Holmberg,Ex Au 3: Soluciones Habitacionales IV,Finalizada,Arquitectura,Secretarí­a de Transporte y Obras Públicas,"Obra en ejecución con 30 unidades funcionales (11 unidades de 3 ambientes, 19 unidades de 4 ambientes) y 3 locales comerciales en planta baja de 200m2 totales (superficie total cubierta 2.813 m2).","$ 51.377.671,00",12,Villa Urquiza,AV MONROE 4243/75,26/6/2017,30/9/2018,15,100,Warlet S.A.,2017,Licitación Pública,267/SIGAF/2017,30700435853,45,Desconocido,0,Desconocido
Donado Holmberg,Ex Au 3: Soluciones Habitacionales V,Finalizada,Arquitectura,Secretarí­a de Transporte y Obras Públicas,"Construcción de un nuevo edificio, en el marco de la Ley 3.396, de aproximadamente 72 unidades funcionales para los beneficiarios de la ex au3. La unidad ejecutora está a cargo del relevamiento, diseño inicial y computo del proyecto, mientras que la licitación y ejecución de la obra estará a cargos de la DGOIyA (SSobras). El edificio estará ubicado en el sector 5 de la traza y poseerá una superficie aproximada de 8.100 m2. Las soluciones habitacionales se distribuyen de la siguiente manera: 51 de 4 ambientes y 21 de 3 ambientes. El edificio poseerá además en planta baja 4 locales comerciales.","$ 134.549.451,00",12,Villa Urquiza,P. I. RIVERA 4216/84,12/12/2017,15/5/2019,17,100,INGECONS S.A.,2017,Licitación Pública,1222-SIGAF/2017,30683399333,0,Desconocido,15733812-MGEYA-DGOIYA-2017,Desconocido
Eje Cí­vico,Plaza de Mayo: Puesta en Valor,Finalizada,Espacio Público,Ministerio de Espacio Público e Higiene Urbana,"El proyecto se realiza en el marco de las obras de puesta en valor del Eje Cí­vico, bajo la idea rectora de mantener los vestigios de la traza original. se amplí­an las superficies de reunión y de encuentro, reduciendo un carril vehicular en cada lateral e incorporándolo a la superficie total de la plaza, ensanchando las veredas peatonales e incorporando nuevos canteros arbolados. Se reemplaza la totalidad del solado existente, recuperando el tradicional color blanco de la plaza, y el proyecto paisají­stico general remodelando los parterres existentes. Asimismo se ejecutaron tareas de restauración y puesta a punto de las fuentes, conjuntos escultóricos e instalaciones en general, incorporando un sistema de riego automático.","$ 43.792.575,00",1,San Nicolás,"BALCARCE, AV. RIVADAVIA, BOLÍ­VAR, HIPÓLITO YRIGOYEN",16/11/2017,16/2/2018,3,100,Urbaser Argentina S.A - Ceob Sa Ute,2017,Desconocida,Desconocido,30714682489,0,Desconocido,0,Desconocido
Plazas y Parques de Comuna 11,Laterales ví­as del tren,Finalizada,Espacio Público,Ministerio de Espacio Público e Higiene Urbana,"Se pondrá en valor los sectores laterales del tren que actualmente se encuentran muy degradados. Se va agregar nuevo mobiliario, iluminación y paisajismo. Esto va a revalorizar la zona y además servir de espacio verde para la sede de la Comuna 11 que se encuentra lindera a este sector.","$ 8.000.000,00",11,Villa del Parque,CUENCA Y RICARDO GUTIERREZ,1/10/2018,6/2/2019,4,100,PRISMA CONSTRUCTORA S.R.L.,2018,Licitación Privada,28/SIGAF/2018,30714290173,0,Desconocido,21303614/DGEV/2018,Desconocido
Plazas y Parques de Comuna 14,Parque voley playa.,Finalizada,Espacio Público,Ministerio de Espacio Público e Higiene Urbana,"Se creará una cancha de Voley con medidas profesionales en el sector del Velódromo dentro del Parque Tres de Febrero. Esta contará de gradas para el público, iluminación, bebederos, mobiliario y nuevos caminos de accesos a la zona.","$ 10.000.000,00",14,Palermo,AV. BELISARIO ROLDAN Y VÍ­AS FF MITRE,1/10/2018,31/12/2018,2,100,CONSTRUCTORA SOLANA S.A.,2018,Licitación Pública,257/SIGAF/2018,30714318337,0,Desconocido,9176047/DGEV/2018,Desconocido
Plazas y Parques de Comuna 15,Agronomí­a - Circuito Aeróbico,Finalizada,Espacio Público,Ministerio de Espacio Público e Higiene Urbana,"Sobre la Av. Beiró se realizara un nuevo circuito en una zona que actualmente es muy usada por los vecinos y no se encuentra en condiciones. Se creará un nuevo solado con mobiliario a lo largo del recorrido. Además se agregará una estación de postas aeróbicas, iluminación y bebederos a lo largo de este.","$ 3.000.000,00",15,Agronomí­a,"AV. DE LOS CONSTITUYENTES, GUTENBERG, BEIRÓ",1/11/2018,28/2/2019,3,100,INSTALECTRO S.A.,2018,Licitación Pública,259/SIGAF/2018,33661628729,0,Desconocido,9102568/DGEV/2018,Desconocido
Plazas y Parques de Comuna 9,Parque Avellaneda: Nuevo circuito aeróbico,Finalizada,Espacio Público,Ministerio de Espacio Público e Higiene Urbana,"Se creará un circuito aeróbico de 3 km de largo por el pedido de los vecinos del barrio. Este contará con dos estaciones de postas aeróbicas y una estación para adultos mayores. Se colocarán bebederos a lo largo del recorrido, mobiliario e iluminación para brindar seguridad a lo largo de todo el recorrido.","$ 11.000.000,00",9,Parque Avellaneda,AV. DIRECTORIO Y LACARRA,1/11/2018,28/2/2019,3,100,Desconocido,2018,Desconocida,Desconocido,Desconocido,0,Desconocido,0,Desconocido
Entorno Ciudad Universitaria,Vagón La Burgoise en FADU-UBA: Proyecto,Finalizada,Espacio Público,Ministerio de Espacio Público e Higiene Urbana,Entorno Urbano - Ciudad Universitaria,"$ 2.185.031,00",13,Belgrano,DESCONOCIDO,6/3/2018,6/3/2018,0,100,Dagresa Vial Construcciones SRL,2018,Desconocida,Desconocido,33712269079,0,Desconocido,0,Desconocido
Entorno Microcentro,Ex Banco Argentino Uruguayo: Conservación de la fachada,Finalizada,Espacio Público,Ministerio de Espacio Público e Higiene Urbana,íreas Ambientales -Obra complemenmtaria al Plan Microcentro que pone en valor la fachada patrimonial,"$ 23.551.750,00",1,Montserrat,DESCONOCIDO,1/6/2018,1/4/2019,10,100,Hit Construcciones S.A,2018,Desconocida,Desconocido,30709605158,0,Desconocido,0,Desconocido
Entorno Once,Plaza Miserere: Puestos gastronómicos,Finalizada,Espacio Público,Ministerio de Espacio Público e Higiene Urbana,"íreas Ambientales -obra en el marco del Plan Integral Once, se reemplazan los puestos gastronómicos deteriorados por infraestructura con mayores condiciones de higiene.","$ 2.794.380,00",3,Balvanera,CATAMARCA Y RIVADAVIA AV.,1/3/2018,21/3/2018,0,100,Estilo Quarzo S.R.L,2018,Licitación Privada,44/SIGAF/2017,30711780846,0,Desconocido,15.262.709/DGRU/2017,Desconocido
Plan Tribunales,Plaza Lavalle: Puestos de libreros,Finalizada,Espacio Público,Ministerio de Espacio Público e Higiene Urbana,"íreas Ambientales -Obra En El Marco Del Plan Integral Tribunales, se reemplazan los puestos de libreros por unidades con mayor calidad paisají­stica y funcional.","$ 6.260.797,00",1,San Nicolás,DESCONOCIDO,1/9/2018,31/12/2018,3,100,Estilo Quarzo S.R.L,2018,Licitación Pública,96/SIGAF/2018,30711780846,0,Desconocido,29.936.101/DGRU/2017,Desconocido
Entorno Liniers,Plan Liniers,Finalizada,Espacio Público,Ministerio de Espacio Público e Higiene Urbana,íreas Ambientales -Obra En El Marco Del Plan Integral Liniers,"$ 79.421.902,00",9,Liniers,DESCONOCIDO,14/9/2018,14/5/2019,8,100,Miavasa S.A,2018,Licitación Pública,260/SIGAF/2018,30677303863,0,Desconocido,10643968/DGRU/2018,Desconocido
Entorno Constitución,Plan Constitución,Finalizada,Espacio Público,Ministerio de Espacio Público e Higiene Urbana,íreas Ambientales -Obra En El Marco Del Plan Integral Constitución,"$ 56.525.534,00",1,Constitución,DESCONOCIDO,9/10/2018,9/8/2019,10,100,DA FRE OBRAS CIVILES S.A,2018,Licitación Pública,321/SIGAF/2018,30711388768,0,Desconocido,18528975/MGEYA/2018,Desconocido
Hospital Gutiérrez,Entorno Hospital Gutierrez,Finalizada,Espacio Público,Ministerio de Espacio Público e Higiene Urbana,"Entornos urbanos. El Proyecto Tiene Como Objetivo Mejorar Las Condiciones Del Espacio Público Que Conforma El Entorno Inmediato Al Hospital, mediante la ejecución de las veredas","$ 13.499.518,00",2,Recoleta,SANCHEZ DE BUSTAMANTE 1440,26/12/2018,15/8/2019,7,100,DYSCONS S.A,2018,Licitación Pública,494/SIGAF/2018,30709502480,0,Desconocido,14987507/GEYA/018,Desconocido
Veredas de comuna 1,25 de Mayo: Reparación de veredas,Finalizada,Espacio Público,Ministerio de Espacio Público e Higiene Urbana,"Obra compleja de 2 cuadras, entre Tucumán y Córdoba","$ 4.163.470,00",1,San Nicolás,25 DE MAYO 601,21/10/2017,9/2/2018,4,100,Naku Construcciones S.R.L,2016,Desconocida,Desconocido,30575292174,0,Desconocido,0,Desconocido
Veredas de comuna 5,Av. Boedo: Reparación de veredas,Finalizada,Espacio Público,Ministerio de Espacio Público e Higiene Urbana,"Obra compleja de 3 cuadras, entre Juan de Garay y Constitución","$ 12.444.131,00",5,Boedo,BOEDO AV. 1287,27/10/2017,26/2/2018,4,100,Altote S.A,2016,Desconocida,Desconocido,30707431896,0,Desconocido,0,Desconocido
Veredas de comuna 1,Av. Bartolomé Mitre: Reparación de veredas,Finalizada,Espacio Público,Ministerio de Espacio Público e Higiene Urbana,"Obra compleja de 3 cuadras,entre Diagonal Norte-C. Pellegrini","$ 8.186.010,00",1,San Nicolás,"MITRE, BARTOLOME 601",11/11/2017,31/1/2018,2,100,Altote S.A,2016,Desconocida,Desconocido,30707431896,0,Desconocido,0,Desconocido
Veredas de comuna 15,Av. Lacroze: Reparación de veredas,Finalizada,Espacio Público,Ministerio de Espacio Público e Higiene Urbana,"Obra compleja de 7 cuadras, entre A. Thomas-Av. Corrientes","$ 29.646.379,00",15,Chacarita,"LACROZE, FEDERICO AV. 3580",7/12/2017,6/3/2018,3,100,Naku Construcciones S.R.L,2016,Desconocida,Desconocido,30575292174,0,Desconocido,0,Desconocido
Veredas de comuna 2,Av. Santa Fe: Reparación de veredas,Finalizada,Espacio Público,Ministerio de Espacio Público e Higiene Urbana,"Obra compleja de 8 cuadras, entre Callao-Pueyrredon","$ 31.570.801,00",2,Recoleta,SANTA FE AV. 1997,15/9/2017,21/5/2018,8,100,Miavasa S.A,2016,Desconocida,Desconocido,30677303863,0,Desconocido,0,Desconocido
Veredas de comuna 12,Av. Triunvirato 1: Reparación de veredas,Finalizada,Espacio Público,Ministerio de Espacio Público e Higiene Urbana,"Obra compleja de 7 cuadras, entre Monroe- La Pampa","$ 25.403.204,00",12,Villa Urquiza,TRIUNVIRATO AV. 4355,17/11/2017,4/5/2018,6,100,Altote S.A,2016,Desconocida,Desconocido,30707431896,0,Desconocido,0,Desconocido
Veredas de comuna 12,Av. Triunvirato II: Reparación de veredas,Finalizada,Espacio Público,Ministerio de Espacio Público e Higiene Urbana,"Obra compleja de 2 cuadra, entre Roosevelt- Dr. P. Rivera","$ 7.597.179,00",12,Villa Urquiza,TRIUNVIRATO AV.4950,7/5/2018,31/8/2018,3,100,Altote S.A,2016,Desconocida,Desconocido,30707431896,0,Desconocido,0,Desconocido
Veredas de comuna 5,Av. Medrano 1: Reparación de veredas,Finalizada,Espacio Público,Ministerio de Espacio Público e Higiene Urbana,"Obra compleja de 4 cuadras, entre Humahuaca- Potosí­","$ 11.805.446,00",5,Almagro,MEDRANO AV.455,4/6/2018,31/12/2018,6,100,SACH,2016,Desconocida,Desconocido,Desconocido,0,Desconocido,0,Desconocido
Veredas de comuna 2,Av. Callao II: Reparación de veredas,Finalizada,Espacio Público,Ministerio de Espacio Público e Higiene Urbana,"Obra compleja de 3 cuadras, entre Córdoba- Santa Fe","$ 11.178.115,00",2,Recoleta,CALLAO AV. 848,14/5/2018,30/9/2018,4,100,Bosquimano S.A,2016,Desconocida,Desconocido,30711470022,0,Desconocido,0,Desconocido
Veredas de comuna 9,Centro de Transbordo: Reparación de veredas,Finalizada,Espacio Público,Ministerio de Espacio Público e Higiene Urbana,Obra de reparación de veredas en el entorno del Centro de Transbordo de Liniers,"$ 11.101.211,00",9,Liniers,"GORDILLO, TIMOTEO 21",29/5/2018,30/9/2018,4,100,Miavasa S.A,2016,Desconocida,Desconocido,30677303863,0,Desconocido,0,Desconocido
Veredas de comuna 9,Montiel: Reparación de veredas,Finalizada,Espacio Público,Ministerio de Espacio Público e Higiene Urbana,"Obra compleja de 2 cuadras, entre Ibarrola- Av. Rivadavia","$ 9.064.458,00",9,Liniers,MONTIEL 185,8/3/2018,30/6/2018,3,100,Miavasa S.A,2016,Desconocida,Desconocido,30677303863,0,Desconocido,0,Desconocido
Destacamentos De Bomberos,Destacamentos De Bomberos: Destacamento de Bomberos - La Boca ,Finalizada,Arquitectura,Corporación Buenos Aires Sur,"La Obra Consiste En La RemodelacionY Refaccion Del Destacamento De Bomberos, Que Incluye La Mayorí­a De Los Locales. Principalmente Las Intervenciones Se Realizaron En Baños, Vestuarios, Cocina Y Espacios De Entrenamiento. Instalacion Electrica Y De Datos","$ 1.878.614,00",4,La Boca,"DON PEDRO DE MENDOZA AV. Y BROWN, ALTE. AV.",16/8/2017,14/11/2017,3,100,A.E. Ponce Ingenieria S.A.,2017,Contratación Directa,11-CBAS-2017,30714763098,0,Desconocido,0,Desconocido
Destacamentos De Bomberos,Destacamentos De Bomberos: Remodelación Cuartel De Bomberos VIII - Nueva Chicago,Finalizada,Arquitectura,Corporación Buenos Aires Sur,"La Obra Consiste En La Refacción y Remodelación De Todo El Cuartel De Bomberos De Barracas Y Contempla El Arreglo De Baños, Dormitorios, Oficinas, Nuevas Instalaciones Eléctricas, Sanitarias y De Datos. Reparación De Filtraciones. ","$ 7.003.511,00",9,Mataderos,"DE LA TORRE, LISANDRO  AV. 2830",6/7/2017,3/12/2017,5,100,Bimasur S.A.,2017,Contratación Directa,32-CBAS-2017,30714031941,0,Desconocido,0,Desconocido
Comisarí­as,Destacamento Barrial:  Calle Coronel M. Chilavert NÂ° 1928 - 1946,Finalizada,Arquitectura,Corporación Buenos Aires Sur,"La Obra Consiste En La Ampliación De Las Instalaciones Existentes De La Ex Metropolitana. Se Desarrolla En Planta Baja, Donde Se Construirán Nuevos Baños, Una Oficina, Cocina Y Comedor Para El Personal.  Se Contempla La Ejecución De Instalaciones Sanitarias: Cloacal Y De Provisión De Agua Frí­a, E Instalación Eléctrica.","$ 4.288.880,00",7,Flores,"CHILAVERT, MARTINIANO, CNEL. 1926 - 1946",31/10/2017,31/12/2017,2,100,DR2 Construcciones S.R.L,2017,Contratación Directa,58-CBAS-2017,30714286605,0,Desconocido,0,Desconocido
Barrio Los Piletones,Barrio Los Piletones: Electrificación 2º Etapa â Conjunto Habitacional Barrio Los Piletones,Finalizada,Hidráulica E Infraestructura,Corporación Buenos Aires Sur,La Obra Consiste En La Ejecución De Las Redes De Distribución Eléctrica De Baja Tensión En El Conjunto Habitacional Barrio Los Piletones 2Â° Etapa,"$ 1.997.794,00",8,Villa Soldati,PLUMERILLO Y ASTURIAS AV (NO OFICIAL),8/8/2017,7/10/2017,2,100,ANTONIO ALAK LTDA,2017,Contratación Directa,44-CBAS-2017,30709930385,0,Desconocido,0,Desconocido
Barrio Los Piletones,Barrio Los Piletones: Puesta en Valor Pasillo y B.R. de Mz 9 y 10 â Sector lindero Lago Barrio Los Piletones,Finalizada,Hidráulica E Infraestructura,Corporación Buenos Aires Sur,"Las Obras A Ejecutar Se Localizan En El Sector Liberado Del lago Sobre El Cual Se Encuentran Bocas De Registro Que Por Efecto Del Terraplenamiento Realizado Es Necesario Elevar Sus Chimeneas Y Tapas Al Nuevo Nivel De Terreno. Por Otro Lado, La Puesta En Valor Del Pasaje De Acceso A Las Manzanas 9 y 10 Del Barrio Los Piletones, Desde El Malecón Del Lago","$ 941.145,00",8,Villa Soldati,LACARRA AV. 2700,3/7/2017,2/8/2017,1,100,LOS PILETONES LTDA,2017,Contratación Directa,41-CBAS-2017,30710477910,0,Desconocido,0,Desconocido
Barrio Los Piletones,Barrio Los Piletones: Reparaciones En Las Redes De Agua Potable Y Colectoras Cloacales,Finalizada,Hidráulica E Infraestructura,Corporación Buenos Aires Sur,"La Obra Consiste En La Ejecución De Diversas Reparaciones En Las Cañerí­as De Redes De Provisión De Agua Potable, Se Han Detectado Averí­as Que Limitan Su Correcto Funcionamiento.","$ 3.781.631,00",8,Villa Soldati,LACARRA AV. 2700,18/9/2017,17/12/2017,3,100,Mel Contrucciones S.R.L,2017,Contratación Directa,42-CBAS-2017,33714510679,0,Desconocido,0,Desconocido
Barrio Los Piletones,"Barrio Los Piletones: Demoliciones Poligono ""A"" De Manzana 10 ",Finalizada,Hidráulica E Infraestructura,Corporación Buenos Aires Sur,La Obra Consiste En La Demolición De Las Edificaciones  A La Necesidad De Liberación Del Lecho Lago Soldati Y Se Realizarán Pequeños Espacios De Recreación.,"$ 1.627.060,00",8,Villa Soldati,LACARRA AV. 2700,11/12/2017,25/1/2018,"1,5",100,LOS PILETONES LTDA,2017,Contratación Directa,53-CBAS-2017,30710477910,0,Desconocido,0,Desconocido
Barrio Los Piletones,"Barrio Los Piletones: Demoliciones Poligono""B"" Y ""E"" De Manzana 10 ",Finalizada,Hidráulica E Infraestructura,Corporación Buenos Aires Sur,La Obra Consiste En La Demolición De Las Edificaciones  A La Necesidad De Liberación Del Lecho Lago Soldati Y Se Realizarán Pequeños Espacios De Recreación.,"$ 865.539,00",8,Villa Soldati,LACARRA AV. 2700,11/12/2017,10/1/2018,1,100,LOS PILETONES LTDA,2017,Contratación Directa,54-CBAS-2017,30710477910,0,Desconocido,0,Desconocido
Barrio Los Piletones,"Barrio Los Piletones: Demoliciones Poligono ""C"" De Manzana 10 ",Finalizada,Hidráulica E Infraestructura,Corporación Buenos Aires Sur,La Obra Consiste En La Demolición De Las Edificaciones  A La Necesidad De Liberación Del Lecho Lago Soldati Y Se Realizarán Pequeños Espacios De Recreación.,"$ 977.356,00",8,Villa Soldati,LACARRA AV. 2700,11/12/2017,10/1/2018,1,100,LOS PILETONES LTDA,2017,Contratación Directa,55-CBAS-2017,30710477910,0,Desconocido,0,Desconocido
Barrio Los Piletones,"Barrio Los Piletones: Readecuación Vivienda en Poligono ""D"" De Manzana 10 - Casa 39",Finalizada,Arquitectura,Corporación Buenos Aires Sur,"La Obra consiste En La Readecuación De Una Vivienda: Cocina, Baño Y   Patio De Acceso, Por Demoliciones De Viviendas Aledañas Al Lago Soldati","$ 767.299,00",8,Villa Soldati,LACARRA AV. 2700,11/12/2017,9/2/2018,2,100,LA UNION LTDA,2017,Contratación Directa,56-CBAS-2017,30711170053,0,Desconocido,0,Desconocido
Barrio Los Piletones,Barrio Los Piletones: Sendero 14 De Mayo,Finalizada,Hidráulica E Infraestructura,Corporación Buenos Aires Sur,"Ejecución De Una Nueva Calle Que Contempla Pavimentos, Pluviales, Luminarias Y Equipamiento.","$ 10.619.424,00",8,Villa Soldati,SENDERO 14 DE MAYO 3900,6/11/2017,5/1/2018,2,100,Bosquimano S.A,2017,Contratación Directa,63-CBAS-2017,30711470022,0,Desconocido,0,Desconocido
Barrio Los Piletones,"Barrio Los Piletones: Demolición Y Construcción De Nueva Vivienda Casa 35/36 Poligono ""D"" Manzana 10",Finalizada,Arquitectura,Corporación Buenos Aires Sur,La Obra Consiste En La Demolición De La Vivienda Existente Y Ejecución De Una Nueva Vivienda De Una Sola Planta Y Recomponer El Espacio Público Aledaño Al Lago Soldati,"$ 1.602.823,00",8,Villa Soldati,LACARRA AV. 2700,11/12/2017,10/4/2018,4,100,Jorge Canelles Ltda,2017,Contratación Directa,64-CBAS-2017,30708832959,0,Desconocido,0,Desconocido
Barrio Los Piletones,"Barrio Los Piletones: Demolición Y Construcción De Nueva Vivienda Casa 31 Poligono ""D"" Manzana 10",Finalizada,Arquitectura,Corporación Buenos Aires Sur,La Obra Consiste En La Demolición De La Vivienda Existente Y Ejecución De Una Nueva Vivienda De Una Sola Planta Y Recomponer El Espacio Público Aledaño Al Lago Soldati,"$ 1.049.221,00",8,Villa Soldati,LACARRA AV. 2700,11/12/2017,11/3/2018,3,100,LA UNION LTDA,2017,Contratación Directa,65-CBAS-2017,30711170053,0,Desconocido,0,Desconocido
Barrio Los Piletones,"Barrio Los Piletones: Demoliciones Poligono ""F"" De Manzana 10",Finalizada,Hidráulica E Infraestructura,Corporación Buenos Aires Sur,La Obra Consiste En La Demolición De Las Edificaciones  A La Necesidad De Liberación Del Lecho Lago Soldati Y Se Realizarán Pequeños Espacios De Recreación.,"$ 859.766,00",8,Villa Soldati,LACARRA AV. 2700,11/12/2017,10/1/2018,1,100,LOS PILETONES LTDA,2017,Contratación Directa,66-CBAS-2017,30710477910,0,Desconocido,0,Desconocido
Barrio Nueva Esperanza,Barrio Nueva Esperanza: Demolición  Vivienda Perilago,Finalizada,Hidráulica E Infraestructura,Corporación Buenos Aires Sur,La Obra Consiste En La Demolición De La Edificacion  A La Necesidad De Liberación Del Lecho Lago Soldati ,"$ 183.219,00",8,Villa Soldati,LACARRA AV. 2700,12/12/2017,27/12/2017,"0,5",100,LOS PILETONES LTDA,2017,Contratación Directa,79-CBAS-2017,30710477910,0,Desconocido,0,Desconocido
Barrio Los Piletones,Barrio Los Piletones: Construcción De Edificio NÂ° 27 Manzana NÂ° 199 - Complejo Habitacional Los Piletones,Finalizada,Vivienda,Corporación Buenos Aires Sur,"La Obra Consiste En La Construcción De Un Edificio De Viviendas De Planta Baja Y Dos Pisos, En  Cada Planta Hay 4 Unidades Funcionales De 4 Ambientes Cada Una. Las 4 Unidades Ubicadas En Planta Baja Se Proyectaron Para Ser Habitadas Por Usuarios Con Movilidad Reducida.","$ 26.268.522,00",8,Villa Soldati,PLUMERILLO 3975,26/6/2017,31/7/2018,12,100,Bosquimano S.A,2017,Licitación Pública,01-CBAS-2017,30711470022,0,Desconocido,0,Desconocido
Barrio Los Piletones,Barrio Los Piletones: Demoliciones Casa 52 Manzana 10 ,Finalizada,Hidráulica E Infraestructura,Corporación Buenos Aires Sur,La Obra Consiste En La Demolición De Las Edificaciones  A La Necesidad De Liberación Del Lecho Lago Soldati Y Se Realizarán Pequeños Espacios De Recreación.,"$ 388.882,00",8,Villa Soldati,LACARRA AV. 2700,25/4/2018,10/6/2018,"1,5",100,LA UNION LTDA,2018,Contratación Directa,06-CBAS-2018,30711170053,0,Desconocido,0,Desconocido
Distrito Del Deporte,Distrito Del Deporte: Club Atlético Huracán - La Quemita - Muro  De Cierre,Finalizada,Arquitectura,Corporación Buenos Aires Sur,Ejecución De Muro Perimetral De Cierre En Bloques De Hormigón En 138 Ml Y 3 Mts De Altura,"$ 1.766.868,00",7,Flores,"CASTAÑARES AV. , LACARRA AV.",7/12/2017,7/3/2018,3,100,14 DE JUNIO LTDA,2017,Contratación Directa,43-CBAS-2017,30711790469,0,Desconocido,0,Desconocido
Autódromo Oscar Y Alfredo Gálvez,"Autódromo Oscar Y Alfredo Gálvez: Puesta En Valor Autódromo De Bs. As. Oscar Y Juan Gálvez -  Instalación De Cubierta Sobre Palco ""A""",Finalizada,Espacio Público,Corporación Buenos Aires Sur,"La Obra Consiste En La Puesta En Valor Del Autódromo De La Ciudad De Bs As Las Tareas A Ejecutar Corresponden A La Instalación De Cubierta Sobre Palcos ""A""","$ 1.817.436,00",8,Villa Riachuelo,"PAZ, GRAL. AV. Y ROCA, CNEL. AV.",3/11/2017,3/3/2018,4,100,Estudio Wagg SA,2017,Contratación Directa,48-CBAS-2017,33651478699,0,Desconocido,0,Desconocido
Autódromo Oscar Y Alfredo Gálvez,"Autódromo Oscar Y Alfredo Gálvez: Puesta En Valor Autódromo De Bs. As. Oscar Y Juan Gálvez -  Instalación De Cubierta Sobre Palco ""B""",Finalizada,Espacio Público,Corporación Buenos Aires Sur,"La Obra Consiste En La Puesta En Valor Del Autódromo De La Ciudad De Bs As Las Tareas A Ejecutar Corresponden A La Instalación De Cubierta Sobre Palcos ""B""","$ 1.817.436,00",8,Villa Riachuelo,"PAZ, GRAL. AV. Y ROCA, CNEL. AV.",3/11/2017,3/3/2018,4,100,Estudio Wagg SA,2017,Contratación Directa,49-CBAS-2017,33651478699,0,Desconocido,0,Desconocido
Autódromo Oscar Y Alfredo Gálvez,"Autódromo Oscar Y Alfredo Gálvez: Bacheo En Autodromo De Bs. As. Oscar Y Juan Galvez-Bacheo En  Calle Interna 
",Finalizada,Espacio Público,Corporación Buenos Aires Sur,La Obra Consiste En La Repavimentación De La Calle Interna De Acceso A Playón Trasero De Boxes,"$ 663.276,00",8,Villa Riachuelo,"PAZ, GRAL. AV. Y ROCA, CNEL. AV.",22/3/2018,21/4/2018,1,100,GOLI Construcciones SRL,2018,Contratación Directa,81-CBAS-2017,30715832255,0,Desconocido,0,Desconocido
Barrio 59 Viviendas,Barrio 59 Viviendas: Reparaciones Eléctricas Domiciliarias ,Finalizada,Vivienda,Corporación Buenos Aires Sur,"La  Obra Comprende El Montaje, La Conexión Y La Puesta En Servicio De Toda La Nueva Instalación Eléctrica De Las Unidades Funcionales Y Servicios Generales Del Conjunto De 59 Viviendas- Barrio Nestor Kirchner.","$ 1.562.563,00",8,Villa Lugano,ESCALADA AV. 4551,15/1/2018,15/4/2018,3,100,24 DE NOVIEMBRE LTDA,2018,Contratación Directa,67-CBAS-2017,30712108629,0,Desconocido,0,Desconocido
Barrio 59 Viviendas,Barrio 59 Viviendas: Reparaciones En Instalación De Gas Natural,Finalizada,Vivienda,Corporación Buenos Aires Sur,La Obra Consiste En La Adecuación De La Instalación De Gas Natural Para Las Unidades De 59 Viviendas - Barrio Nestor Kirchner,"$ 1.437.627,00",8,Villa Lugano,ESCALADA AV. 4551,4/4/2018,3/7/2018,3,100,24 DE NOVIEMBRE LTDA,2018,Contratación Directa,73-CBAS-2017,30712108629,0,Desconocido,0,Desconocido
